{
  "serviceId": "9e2c6a8b0d5f7c1",
  "type": "acl",
  "tenant": "acme",
  "acl": {
    "name": "web-ingress",
    "stage": "ingress",
    "type": "ipv4",
    "defaultAction": "deny",
    "rules": [
      {
        "name": "allow-https",
        "priority": 100,
        "action": "permit",
        "protocol": "tcp",
        "sourcePrefix": "10.0.0.0/24",
        "destinationPort": "443",
        "description": "operator https allowance"
      }
    ]
  },
  "endpoints": []
}
