{
  "serviceId": "3b5d7f9a1c2e4f6",
  "type": "mac-vrf",
  "tenant": "acme",
  "routeTargets": {"importRT": ["target:65000:10021"], "exportRT": ["target:65000:10021"]},
  "l2vni": 10021,
  "unsupported": {"traffic-engineering": {"policy": "rsvp-te"}},
  "endpoints": [
    {"node": "leaf01", "attachment": "ethernet-1/1", "vlan": 100},
    {"node": "leaf02", "attachment": "ethernet-1/1", "vlan": 100}
  ]
}
