{
  "serviceId": "6d9b3f5a7c2e4b8",
  "type": "acl",
  "tenant": "acme",
  "acl": {
    "name": "web-ingress",
    "stage": "ingress",
    "type": "ipv4",
    "defaultAction": "deny",
    "rules": [
      {
        "name": "allow-https",
        "priority": 100,
        "action": "permit",
        "protocol": "tcp",
        "sourcePrefix": "10.0.0.0/24",
        "destinationPort": "443",
        "description": "operator https allowance"
      }
    ]
  },
  "endpoints": [
    {
      "node": "leaf01",
      "attachment": "ethernet-1/1",
      "vlan": 1500
    },
    {
      "node": "leaf02",
      "attachment": "ethernet-1/1",
      "vlan": 1500
    }
  ]
}
