{
  "serviceId": "0f3d7b9c1e6a8d2",
  "type": "acl",
  "tenant": "acme",
  "acl": {
    "name": "web-ingress",
    "stage": "egress",
    "type": "ipv4",
    "defaultAction": "deny",
    "rules": [
      {
        "name": "allow-https",
        "priority": 100,
        "action": "permit",
        "protocol": "tcp",
        "sourcePrefix": "10.0.0.0/24",
        "destinationPort": "443",
        "description": "operator https allowance"
      }
    ]
  },
  "endpoints": [
    {
      "node": "leaf01",
      "attachment": "ethernet-1/1",
      "vlan": 100
    }
  ]
}
